{
  "year": 2022,
  "make": "TOYOTA",
  "model": "COROLLA",
  "body_class": "SEDAN",
  "glass_layout": "sedan",
  "doors": 4,
  "features": {
    "adas": true,
    "rain_sensor": false,
    "heated": false,
    "acoustic": false
  },
  "glass": {
    "windshield": {
      "type": "laminated",
      "features": [
        "adas"
      ],
      "price": [
        250,
        400
      ]
    },
    "back_glass": {
      "type": "tempered",
      "features": [],
      "price": [
        220,
        420
      ]
    },
    "front_left_door": {
      "type": "tempered",
      "features": [],
      "price": [
        90,
        190
      ]
    },
    "front_right_door": {
      "type": "tempered",
      "features": [],
      "price": [
        90,
        190
      ]
    },
    "rear_left_door": {
      "type": "tempered",
      "features": [],
      "price": [
        90,
        190
      ]
    },
    "rear_right_door": {
      "type": "tempered",
      "features": [],
      "price": [
        90,
        190
      ]
    }
  },
  "confidence": 0.9,
  "last_updated": "2026-04-17",
  "sources": [
    "derived",
    "market_data"
  ]
}