{
  "year": 2023,
  "make": "KIA",
  "model": "TELLURIDE",
  "body_class": "SUV",
  "glass_layout": "suv",
  "doors": 4,
  "features": {
    "adas": true,
    "rain_sensor": true,
    "heated": false,
    "acoustic": false
  },
  "glass": {
    "windshield": {
      "type": "laminated",
      "features": [
        "adas",
        "rain_sensor"
      ],
      "price": [
        340,
        540
      ]
    },
    "back_glass": {
      "type": "tempered",
      "features": [],
      "price": [
        320,
        640
      ]
    },
    "front_left_door": {
      "type": "tempered",
      "features": [],
      "price": [
        110,
        230
      ]
    },
    "front_right_door": {
      "type": "tempered",
      "features": [],
      "price": [
        110,
        230
      ]
    },
    "rear_left_door": {
      "type": "tempered",
      "features": [],
      "price": [
        110,
        230
      ]
    },
    "rear_right_door": {
      "type": "tempered",
      "features": [],
      "price": [
        110,
        230
      ]
    }
  },
  "confidence": 0.85,
  "last_updated": "2026-04-17",
  "sources": [
    "derived",
    "market_data"
  ]
}